{"package_id":"EQA-PKG-EXAMPLE-001","run_id":"EQA-RUN-EXAMPLE-001","approved_output_artifact_ids":["OUT-EXAMPLE"],"family_statuses":[{"family":"Technical Editing","status":"pass","release_effect":"none"}],"release_checklist":[{"item":"receipt","status":"pass","evidence":"EQA-REC-EXAMPLE-001"}],"open_item_disposition":"Track heading issue with TE owner.","provenance_receipt_id":"EQA-REC-EXAMPLE-001","fixity_values":["sha256:out"],"version_status_record":"v1","accessibility_coverage":{"formats":["docx"],"targets":["internal review"],"scope":"heading/object inventory","limitations":["not accessibility conformance"]},"release_decision":"ready_with_tracked_items","release_owner":"volume editor","residual_risk":"moderate"}
